<?xml version="1.0" encoding="UTF-8" standalone="yes"?>
<ResultCodes xmlns:xsi="http://www.w3.org/2001/XMLSchema-instance"
             xsi:noNamespaceSchemaLocation="SFResultCode.xsd"
             Facility="Engine"
             IDTable="false"
             >


	<ResultCodeItem Severity="Error" CodeName="INITIALIZATION_FAILED" Desc="Engine initialization is failed"/>
	<ResultCodeItem Severity="Error" CodeName="INVALID_CONFIG" Desc="Invalid configuration"/>
	<ResultCodeItem Severity="Error" CodeName="CONNECTION_FAILED" Desc="Connection failed"/>
	<ResultCodeItem Severity="Error" CodeName="CONNECTION_LOST" Desc="Connectionlost"/>

	<ResultCodeItem Severity="Error" CodeName="INVALID_CHARACTER" Desc="Invalid character data"/>
	
	<ResultCodeItem Severity="Error" CodeName="INVALID_TABLE_ID" Desc="Invalid table id"/>
    <ResultCodeItem Severity="Error" CodeName="INVALID_PLATFORM" Desc="Invalid platform"/>
    <ResultCodeItem Severity="Error" CodeName="ALREADY_USED_ITEM" Desc="Already Used Item"/>
    <ResultCodeItem Severity="Error" CodeName="ALREADY_USED_KEY" Desc="Already Used Key"/>

    <ResultCodeItem Severity="Error" CodeName="INVALID_ONLINE_SESSION" Desc="Invalid online session. probably kicked/expired"/>
    <ResultCodeItem Severity="Error" CodeName="INVALID_SESSION_TOKEN" Desc="Invalid session token. probably dupe login"/>
    <ResultCodeItem Severity="Error" CodeName="INVALID_GAME_SESSION" Desc="Invalid session GameUID. probably dupe login"/>

    <ResultCodeItem Severity="Error" CodeName="INVALIDD_TITLE_GUID" Desc="Invalid title guid"/>
    <ResultCodeItem Severity="Error" CodeName="INVALIDD_TITLE_ENV" Desc="Invalid titile env"/>


</ResultCodes>

